{
  "reportVersion": "1.0.0",
  "matches": true,
  "sourceBundleId": "mario_rossi_week_2026_10_12__runtime_1.1.0__home_mario_monteverde__behavior_1.1.0__1.0.0",
  "expectedSemanticDigest": "58d126db696a5c70d6c72ea19945cdcfcb99a1d820e5f7495365ff0d4400dbb5",
  "actualSemanticDigest": "58d126db696a5c70d6c72ea19945cdcfcb99a1d820e5f7495365ff0d4400dbb5",
  "simulationReport": {
    "reportVersion": "1.0.0",
    "success": true,
    "sourceBundleId": "mario_rossi_week_2026_10_12__runtime_1.1.0__home_mario_monteverde__behavior_1.1.0__1.0.0",
    "sourceBundleSha256": "b3cb369ace6a271fc7735b42ba849c56ba391b4dae112353fda7e079a77d5cf6",
    "traceSha256": "2d4c8a96deda2ab558899cd37ff84a09d7e42b246e52748f28cbe6d7ff4fa665",
    "semanticDigest": "58d126db696a5c70d6c72ea19945cdcfcb99a1d820e5f7495365ff0d4400dbb5",
    "issues": [],
    "summary": {
      "plannedActivityCount": 169,
      "completedActivityCount": 58,
      "deviatedActivityCount": 111,
      "failedActivityCount": 0,
      "droppedActivityCount": 3,
      "actionExecutionCount": 795,
      "movementCount": 204,
      "stateTransitionCount": 1539,
      "runtimeEventCount": 2,
      "errorCount": 0,
      "warningCount": 0
    }
  }
}
